{
  "schemaVersion": "1.1",
  "sourceId": "042-matovye-potolki",
  "pageType": "service-detail",
  "generatedAgainst": {
    "profileId": "potolki-inner",
    "profileVersion": "2.0.0",
    "manifestHash": "sha256:a9e704060ec2847c6972687bbb62e4862ea9463b6823154e70ed30c726895a66"
  },
  "target": {
    "siteKey": "potolkinaveka40",
    "profileId": "potolki-inner"
  },
  "post": {
    "title": "Матовые натяжные потолки",
    "slug": "matovye",
    "parent": {"path": "/uslugi/vidy-potolkov/"},
    "categoryLabel": "Виды потолков"
  },
  "seo": {
    "title": "Матовые натяжные потолки в Калуге — цена и установка",
    "description": "Матовые натяжные потолки в Калуге с установкой под ключ. Бесплатный замер и расчёт стоимости.",
    "primaryKeyword": "матовые натяжные потолки Калуга"
  },
  "sections": [
    {
      "id": "hero",
      "type": "hero",
      "data": {
        "kicker": "Виды потолков · Калуга и область",
        "title": "Матовые натяжные потолки в Калуге",
        "lead": [
          "Универсальная спокойная фактура для квартиры и дома.",
          "Подберём полотно, профиль и освещение на **бесплатном замере**."
        ],
        "primaryAction": {
          "label": "Рассчитать стоимость",
          "link": {"kind": "anchor", "anchor": "request"}
        },
        "image": {
          "source": "themeAsset",
          "ref": "type-matte",
          "alt": "Матовый натяжной потолок в интерьере"
        }
      }
    },
    {
      "id": "what-is-matte",
      "type": "article",
      "data": {
        "title": "Что такое матовый натяжной потолок",
        "body": [
          {
            "type": "paragraph",
            "text": "Матовой называют фактуру, которая практически не создаёт зеркальных отражений."
          },
          {
            "type": "heading",
            "level": 3,
            "text": "Где использовать"
          },
          {
            "type": "list",
            "style": "unordered",
            "items": [
              "в спальне и детской",
              "в гостиной",
              "на кухне"
            ]
          },
          {
            "type": "buttons",
            "items": [
              {
                "label": "Посмотреть цены",
                "link": {"kind": "path", "path": "/ceny/"}
              }
            ]
          }
        ]
      }
    },
    {
      "id": "installation-process",
      "type": "steps",
      "data": {
        "kicker": "Процесс",
        "title": "Как проходит установка",
        "items": [
          {"title": "Замер", "text": "Уточняем размеры и конфигурацию помещения."},
          {"title": "Расчёт", "text": "Фиксируем комплект и стоимость."},
          {"title": "Монтаж", "text": "Устанавливаем потолок и освещение."}
        ]
      }
    },
    {
      "id": "faq",
      "type": "faq",
      "data": {
        "kicker": "Ответы эксперта",
        "title": "Частые вопросы",
        "items": [
          {
            "question": "Матовый потолок подходит для кухни?",
            "answer": "Да, конкретное полотно подбирается с учётом условий помещения."
          },
          {
            "question": "Можно ли установить встроенные светильники?",
            "answer": "Да, схему и закладные желательно определить до монтажа."
          },
          {
            "question": "От чего зависит цена?",
            "answer": "От площади, профиля, количества углов, освещения и дополнительных конструкций."
          }
        ]
      }
    },
    {
      "id": "request",
      "type": "cta",
      "data": {
        "variant": "form",
        "title": "Рассчитаем стоимость матового потолка",
        "text": "Оставьте номер телефона — уточним задачу и подготовим предварительный расчёт.",
        "primaryAction": {"label": "Получить расчёт"}
      }
    }
  ]
}
